{
  "$schema": "./lesson.schema.json",
  "id": "molihua-opening-v1",
  "version": "1.0.0",
  "title": "茉莉花",
  "variant": "江苏民歌；按湖南艺术职业学院所载谱例开头两小节",
  "status": "score-checked-local-reference",
  "source": {
    "sourceType": "pdf-excerpt",
    "sourceId": "src-molihua-arthn-2021",
    "title": "湖南艺术职业学院2021级公共文化服务与管理专业技能考核标准及题库",
    "url": "https://jwc.arthn.com/__local/7/B3/83/3107CEF266DCC87041DDD41E5CA_A3C890B5_1DAFB6.pdf",
    "pdfPage": 30,
    "printedPage": "27",
    "location": "试题2-6《茉莉花》，第一行前两小节",
    "accessed": "2026-09-12",
    "key": "E major",
    "tonicMidi": 64,
    "meter": [4, 4],
    "tempoText": "中速 亲切的",
    "rights": "公开谱例仅查阅；未标明开放许可证，原PDF不随网页分发。仅转录所选短乐句供本地校验，未使用第三方录音。"
  },
  "teaching": {
    "key": "C major",
    "tonicMidi": 60,
    "transposeSemitones": -4,
    "meter": [4, 4],
    "bpm": 80,
    "slowBpm": 60,
    "tuningA4Hz": 440,
    "temperament": "12-TET",
    "measures": 2,
    "beats": 8,
    "pitchRange": [64, 72],
    "description": "保留谱源音程和时值，移调降低音区；80/60 BPM为项目练习设置，不是谱源标注的数值。"
  },
  "events": [
    {"id":"n01","measure":1,"beat":0,"degree":3,"octave":0,"midi":64,"pitch":"E4","durationBeats":1,"slur":null,"lyric":{"lineId":"l1","index":0,"syllable":"好"}},
    {"id":"n02","measure":1,"beat":1,"degree":3,"octave":0,"midi":64,"pitch":"E4","durationBeats":0.5,"slur":null,"lyric":{"lineId":"l1","index":1,"syllable":"一"}},
    {"id":"n03","measure":1,"beat":1.5,"degree":5,"octave":0,"midi":67,"pitch":"G4","durationBeats":0.5,"slur":null,"lyric":{"lineId":"l1","index":2,"syllable":"朵"}},
    {"id":"n04","measure":1,"beat":2,"degree":6,"octave":0,"midi":69,"pitch":"A4","durationBeats":0.5,"slur":"s1","lyric":{"lineId":"l1","index":3,"syllable":"美"}},
    {"id":"n05","measure":1,"beat":2.5,"degree":1,"octave":1,"midi":72,"pitch":"C5","durationBeats":0.5,"slur":"s1","lyric":{"lineId":"l1","index":4,"syllable":"丽"}},
    {"id":"n06","measure":1,"beat":3,"degree":1,"octave":1,"midi":72,"pitch":"C5","durationBeats":0.5,"slur":null,"lyric":{"lineId":"l1","index":5,"syllable":"的"}},
    {"id":"n07","measure":1,"beat":3.5,"degree":6,"octave":0,"midi":69,"pitch":"A4","durationBeats":0.5,"slur":null,"lyric":{"lineId":"l1","index":6,"syllable":"茉"}},
    {"id":"n08","measure":2,"beat":4,"degree":5,"octave":0,"midi":67,"pitch":"G4","durationBeats":1,"slur":null,"lyric":{"lineId":"l1","index":7,"syllable":"莉"}},
    {"id":"n09","measure":2,"beat":5,"degree":5,"octave":0,"midi":67,"pitch":"G4","durationBeats":0.5,"slur":"s2","lyric":{"lineId":"l1","index":8,"syllable":"花"}},
    {"id":"n10","measure":2,"beat":5.5,"degree":6,"octave":0,"midi":69,"pitch":"A4","durationBeats":0.5,"slur":"s2","lyric":{"lineId":"l1","index":8,"syllable":"花","melisma":true}},
    {"id":"n11","measure":2,"beat":6,"degree":5,"octave":0,"midi":67,"pitch":"G4","durationBeats":2,"slur":null,"lyric":{"lineId":"l1","index":8,"syllable":"花","melisma":true}}
  ],
  "lyrics": {
    "language": "zh",
    "sourceId": "src-molihua-arthn-2021",
    "lines": [
      {"id":"l1","text":"好一朵美丽的茉莉花","syllables":["好","一","朵","美","丽","的","茉","莉","花"]}
    ],
    "provenance": "唱词随旋律片段逐音引用（来源记录 quotation 范围内）；末字「花」按拖腔跨最后三个音演唱。"
  },
  "audio": {
    "renderer": "additive-synthesis-v1",
    "sampleRate": 44100,
    "channels": 1,
    "bitDepth": 16,
    "gateRatio": 0.92,
    "tailSeconds": 0.25,
    "reference": "assets/audio/molihua-c-80.wav",
    "slow": "assets/audio/molihua-c-60.wav",
    "countIn": "assets/audio/molihua-c-80-countin.wav",
    "vocal": "assets/audio/molihua-c-80-vocal.wav",
    "vocalSlow": "assets/audio/molihua-c-60-vocal.wav",
    "countInBeats": 4,
    "provenance": "由本JSON逐音合成；电子音参考，不是真人范唱，也不模拟民族唱腔与谱面表情。带歌词示范用共振峰元音合成逐字唱出唱词（vocal-formant-v2：声母起音+复合元音滑动+轻微颤音），同样是合成音，不是真人演唱。音符间留8%分离间隙便于辨音，乐谱时值不缩短。"
  },
  "objectives": [
    {"id":"pulse","text":"用四拍循环拍手，保持8拍的稳定节拍","evidence":"教师观察四拍循环是否连续，不以示例分数判定"},
    {"id":"pitch","text":"辨认并模唱E4到C5的上行与返回，注意第5、6音为重复高音","evidence":"对照11个参考音符逐音检查，自动检测在后续任务实现"},
    {"id":"duration","text":"唱清半拍音与最后持续两拍的G4","evidence":"教师按拍数核对长短关系"}
  ],
  "constraints": {"minMinutes":10,"maxMinutes":90,"minStudents":1,"maxStudents":80,"defaultMinutes":40,"defaultStudents":28,"defaultGrade":"四年级","smallGroupThreshold":24,"groupSize":7,"equipmentAlternatives":{"无钢琴":"电子音参考 + 拍手计拍 + 轻声模唱","有钢琴":"教师键盘示范同一C调短乐句 + 学生模唱"}},
  "activities": [
    {"id":"warmup","title":"声音热身","weight":5,"goal":"pulse","teacher":"轻声模仿自然声音，做舒适音区的呼应。","student":"听到老师提示后轻声模仿。"},
    {"id":"pulse","title":"四拍律动","weight":7,"goal":"pulse","teacher":"按1强、2弱、3次强、4弱循环示范，随后保持稳定8拍。","student":"以拍手和轻拍膝盖表示四拍循环。"},
    {"id":"reference","title":"聆听两小节","weight":5,"goal":"pitch","teacher":"播放C调80 BPM电子音参考，指出两个相邻C5是两次发音。","student":"不急着唱，用手势跟随旋律高低。"},
    {"id":"imitate","title":"分句模唱","weight":10,"goal":"pitch","teacher":"先用60 BPM逐小节模唱，再连接两小节。","student":"用啦模唱11个音，末音保持两拍。"},
    {"id":"observe","title":"录音与观察","weight":6,"goal":"duration","teacher":"选择单人短乐句录音，回听长短与高低；本版无自动评分。","student":"演唱两小节，其他孩子安静聆听。"},
    {"id":"practice","title":"针对性练习","weight":5,"goal":"pitch","teacher":"按实际回听选择阶梯音或四拍律动；自动决策仍为示例。","student":"先修正一个问题，再唱原短句。"},
    {"id":"summary","title":"课堂小结","weight":2,"goal":"duration","teacher":"请孩子说出重复高音和末音两拍两个观察点。","student":"描述今天听到的变化，不把示例分数当成学习结果。"}
  ]
}
